{
  "kind": "model_profile",
  "schema_version": "benchmark_model_profile_v1",
  "model": {
    "model_id": "lmstudio-community/Mistral-7B-Instruct-v0.3-GGUF-Q4_K_M",
    "server_id": "ollama-local",
    "display_name": "Mistral-7B-Instruct-v0.3-GGUF-Q4_K_M",
    "base_model_name": "Mistral-7B-Instruct-v0.3"
  },
  "identity": {
    "provider": "mistral",
    "family": "mistral",
    "version": "7B-Instruct-v0.3",
    "revision": null,
    "checksum": null,
    "quantized_provider": "lmstudio-community"
  },
  "inference_server": {
    "server_id": "ollama-local",
    "display_name": "Local Ollama"
  },
  "runtime": {
    "server_software": {
      "name": "ollama",
      "version": null,
      "build": null
    },
    "api": {
      "schema_family": ["ollama"],
      "api_version": null
    }
  },
  "endpoints": {
    "base_url": "http://localhost:11434"
  },
  "capabilities": {
    "server": {
      "streaming": true,
      "models_endpoint": true
    },
    "generation": {
      "text": true,
      "json_schema_output": true,
      "tools": false,
      "embeddings": false
    },
    "multimodal": {},
    "reasoning": {},
    "concurrency": {},
    "enforcement": "server"
  },
  "discovery": {
    "retrieved_at": "2026-05-16T15:30:00Z"
  }
}
